{
 "$schema": "http://json-schema.org/draft-07/schema#",
 "$id": "https://osf-schemas/next/validation/source-schema.json",
 "title": "OSF Source descriptor — next/ (AC-1 coverage: sources alongside profiles) — v2.0",
 "description": "Permissive AJV meta-schema for files under next/sources/** (postgresql/, rest/, static/). AC-1 requires the next/ validation pipeline to cover sources AND sync (not just profiles). This schema is deliberately CONSERVATIVE/PERMISSIVE: 'additionalProperties': true everywhere it is not certain, so it adds COVERAGE without imposing new constraints that would false-fail the existing, varied source files (DB pollers with columnMappings/edges, REST pollers with response/polling, and the static/anchor source with records[]/relationships[]/profileRefs[]). It pins only the small, universally-present spine: sourceId, version, sourceType, syncType, the SHAPE of columnMappings/edges WHEN present — and, since 2026-07-15, the location block: REQUIRED on opcua/mtconnect sources, vocabulary-pinned wherever present. History: sgm-006 shipped {site, area: 'Molding', line: 'LineA'} — no enterprise, no type, different casing than every sister — and under 7-segment Class-A UNS subjects (factory.<site>.<area>.<line>.<machine>...) landed in a differently-spelled area/line than sgm-001/004/005, silently, because nothing validated the block. Deeper, per-sourceType semantics (connection shapes, valueMap, anchor records) are reviewed, not schema-pinned — same 'loose facet' pattern as isa95/constraints in the profile schemas. The id-property check (exactly one isId per source) is enforced separately where needed, not here.",
 "type": "object",
 "required": ["sourceId", "version", "sourceType"],
 "properties": {
 "_comment": { "type": "string", "description": "Optional doc/meta key (example/demo fixtures)." },
 "_example": { "type": "boolean", "description": "Optional meta flag: example/demo fixture, not canonical." },
 "sourceId": { "type": "string", "minLength": 1 },
 "version": { "type": "string", "pattern": "^[0-9]+\\.[0-9]+\\.[0-9]+$" },
 "sourceType": { "type": "string", "enum": ["postgresql", "postgres", "rest", "static", "opcua", "mqtt", "mtconnect", "file", "csv"] },
 "syncType": { "type": "string", "enum": ["polling", "anchor", "webhook", "streaming", "manual", "full_refresh"] },
 "profileRef": { "type": "string" },
 "profileRefs": { "type": "array", "items": { "type": "string" } },
 "transport": { "type": "array", "items": { "type": "string" } },
 "description": { "type": "string" },
 "location": {
 "type": "object",
 "description": "Physical placement of the machine in the UNS topology — every segment here becomes a literal subject token (factory.<site>.<area>.<line>.<machine>...). PINNED 2026-07-15 (root cause of the sgm-006 drift): when a source carries 'location', enterprise/site are REQUIRED, area/line too for a machine-protocol source (allOf below; CAPT-TOPICS 24.09.: a Level-3/4 REST source stands at an enterprise and a site, not at a line) and must be lowercase kebab-case — the vocabulary every green source already uses (enterprise 'factory', site 'werk1', area 'cnc'|'sgm', line 'line-a'|'line-mtc'). 'type' (machine class, e.g. 'CNC'/'SGM') is optional but UPPERCASE when present. additionalProperties: false — a stray mis-cased key ('Area', 'Line') must fail loudly, not ride along silently next to the required ones.",
 "required": ["enterprise", "site"],
 "properties": {
 "enterprise": { "type": "string", "pattern": "^[a-z0-9]+(-[a-z0-9]+)*$" },
 "site": { "type": "string", "pattern": "^[a-z0-9]+(-[a-z0-9]+)*$" },
 "area": { "type": "string", "pattern": "^[a-z0-9]+(-[a-z0-9]+)*$" },
 "line": { "type": "string", "pattern": "^[a-z0-9]+(-[a-z0-9]+)*$" },
 "type": { "type": "string", "pattern": "^[A-Z][A-Z0-9]*(-[A-Z0-9]+)*$" }
 },
 "additionalProperties": false
 },
 "connection": { "type": "object", "additionalProperties": true },
 "response": { "type": "object", "additionalProperties": true },
 "polling": { "type": "object", "additionalProperties": true },
 "filter": { "type": ["string", "null"] },
 "snapshotSubject": { "type": "string" },
 "anchor": { "type": "object", "additionalProperties": true },
 "records": { "type": "array", "items": { "type": "object", "additionalProperties": true } },
 "relationships": { "type": "array", "items": { "type": "object", "additionalProperties": true } },
 "columnMappings": {
 "type": "array",
 "description": "Column/field -> SM attribute projection. Each entry maps a source 'column' (or a literal 'const', or a template) onto an 'smAttribute'. Loosely typed: at least one of column/const must be present, smAttribute is required; optional isId/valueMap. additionalProperties allowed for forward-compat (e.g. template/transform).",
 "items": {
 "type": "object",
 "required": ["smAttribute"],
 "properties": {
 "column": { "type": "string" },
 "const": {},
 "smAttribute": { "type": "string", "minLength": 1 },
 "isId": { "type": "boolean" },
 "valueMap": { "type": "object", "additionalProperties": true }
 },
 "anyOf": [
 { "required": ["column"] },
 { "required": ["const"] }
 ],
 "additionalProperties": true
 }
 },
 "edges": {
 "type": "array",
 "description": "KG edges projected from this source (kg-builder / it-edge canonical KG projection). Loosely typed: 'type' is the relationship label; fkColumn/targetIdProp wire the join. additionalProperties allowed for forward-compat.",
 "items": {
 "type": "object",
 "required": ["type"],
 "properties": {
 "type": { "type": "string", "minLength": 1 },
 "fkColumn": { "type": "string" },
 "targetIdProp": { "type": "string" }
 },
 "additionalProperties": true
 }
 }
 },
 "allOf": [
 {
 "_comment": "Machine-protocol sources (opcua, mtconnect) MUST declare where the machine stands — the UNS subject is built from it. Every green opcua/mtconnect source already does; a new one without a location would land on a default/empty subject just as silently as sgm-006 landed on a mis-spelled one. postgresql/static/etc. sources are not forced; rest sources are (next entry).",
 "if": {
 "properties": { "sourceType": { "enum": ["opcua", "mtconnect"] } },
 "required": ["sourceType"]
 },
 "then": { "required": ["location"], "properties": { "location": { "required": ["enterprise", "site", "area", "line"] } } }
 },
 {
 "_comment": "REST sources (ERP/QMS/WMS, Level 3/4) MUST declare enterprise and site (owner 24.09.): the UNS path and the business subject of standard/sync/uns-convention.json are built from them; a missing location is a check error, never a default.",
 "if": {
 "properties": { "sourceType": { "const": "rest" } },
 "required": ["sourceType"]
 },
 "then": { "required": ["location"] }
 }
 ],
 "additionalProperties": true
}
